{
  "metadata": {
    "generated_at": "2026-03-24T10:02:46.996424+00:00",
    "repository": "/mnt/c/Users/arman/PyCharmMiscProject/go-config",
    "commit": "ad7643a6ab86e805e5350e5d38ea3c3f54688b68",
    "branch": "main",
    "inputs": {
      "bench_raw_dir": "/mnt/c/Users/arman/PyCharmMiscProject/go-config/tooling/benchmarks/results/raw",
      "bench_compare_file": "/mnt/c/Users/arman/PyCharmMiscProject/go-config/tooling/benchmarks/results/compare/benchstat.txt",
      "profiles_raw_dir": "/mnt/c/Users/arman/PyCharmMiscProject/go-config/tooling/profiles/raw",
      "coverage_file": "/mnt/c/Users/arman/PyCharmMiscProject/go-config/coverage.out"
    }
  },
  "benchmarks": {
    "source_file": "/mnt/c/Users/arman/PyCharmMiscProject/go-config/tooling/benchmarks/results/raw/bench-20260324133008.txt",
    "benchmark_count": 870,
    "benchmarks": [
      {
        "name": "BenchmarkCompare_SingleSource_JSON/Compare/All/JSON/go-config",
        "iterations": 230743,
        "ns_per_op": 4679.0,
        "bytes_per_op": 2640.0,
        "allocs_per_op": 41.0
      },
      {
        "name": "BenchmarkCompare_SingleSource_JSON/Compare/All/JSON/go-config",
        "iterations": 251180,
        "ns_per_op": 4646.0,
        "bytes_per_op": 2640.0,
        "allocs_per_op": 41.0
      },
      {
        "name": "BenchmarkCompare_SingleSource_JSON/Compare/All/JSON/go-config",
        "iterations": 247072,
        "ns_per_op": 4822.0,
        "bytes_per_op": 2640.0,
        "allocs_per_op": 41.0
      },
      {
        "name": "BenchmarkCompare_SingleSource_JSON/Compare/All/JSON/go-config",
        "iterations": 234735,
        "ns_per_op": 4703.0,
        "bytes_per_op": 2640.0,
        "allocs_per_op": 41.0
      },
      {
        "name": "BenchmarkCompare_SingleSource_JSON/Compare/All/JSON/go-config",
        "iterations": 238593,
        "ns_per_op": 4699.0,
        "bytes_per_op": 2640.0,
        "allocs_per_op": 41.0
      },
      {
        "name": "BenchmarkCompare_SingleSource_JSON/Compare/All/JSON/go-config",
        "iterations": 224076,
        "ns_per_op": 4669.0,
        "bytes_per_op": 2640.0,
        "allocs_per_op": 41.0
      },
      {
        "name": "BenchmarkCompare_SingleSource_JSON/Compare/All/JSON/go-config",
        "iterations": 242895,
        "ns_per_op": 4749.0,
        "bytes_per_op": 2640.0,
        "allocs_per_op": 41.0
      },
      {
        "name": "BenchmarkCompare_SingleSource_JSON/Compare/All/JSON/go-config",
        "iterations": 234241,
        "ns_per_op": 4762.0,
        "bytes_per_op": 2640.0,
        "allocs_per_op": 41.0
      },
      {
        "name": "BenchmarkCompare_SingleSource_JSON/Compare/All/JSON/go-config",
        "iterations": 234998,
        "ns_per_op": 4845.0,
        "bytes_per_op": 2640.0,
        "allocs_per_op": 41.0
      },
      {
        "name": "BenchmarkCompare_SingleSource_JSON/Compare/All/JSON/go-config",
        "iterations": 235207,
        "ns_per_op": 5085.0,
        "bytes_per_op": 2640.0,
        "allocs_per_op": 41.0
      },
      {
        "name": "BenchmarkCompare_SingleSource_JSON/Compare/All/JSON/viper",
        "iterations": 70196,
        "ns_per_op": 15861.0,
        "bytes_per_op": 7327.0,
        "allocs_per_op": 127.0
      },
      {
        "name": "BenchmarkCompare_SingleSource_JSON/Compare/All/JSON/viper",
        "iterations": 74727,
        "ns_per_op": 16046.0,
        "bytes_per_op": 7327.0,
        "allocs_per_op": 127.0
      },
      {
        "name": "BenchmarkCompare_SingleSource_JSON/Compare/All/JSON/viper",
        "iterations": 72261,
        "ns_per_op": 16025.0,
        "bytes_per_op": 7327.0,
        "allocs_per_op": 127.0
      },
      {
        "name": "BenchmarkCompare_SingleSource_JSON/Compare/All/JSON/viper",
        "iterations": 73948,
        "ns_per_op": 15856.0,
        "bytes_per_op": 7327.0,
        "allocs_per_op": 127.0
      },
      {
        "name": "BenchmarkCompare_SingleSource_JSON/Compare/All/JSON/viper",
        "iterations": 75600,
        "ns_per_op": 15743.0,
        "bytes_per_op": 7327.0,
        "allocs_per_op": 127.0
      },
      {
        "name": "BenchmarkCompare_SingleSource_JSON/Compare/All/JSON/viper",
        "iterations": 77846,
        "ns_per_op": 15549.0,
        "bytes_per_op": 7327.0,
        "allocs_per_op": 127.0
      },
      {
        "name": "BenchmarkCompare_SingleSource_JSON/Compare/All/JSON/viper",
        "iterations": 75580,
        "ns_per_op": 15539.0,
        "bytes_per_op": 7327.0,
        "allocs_per_op": 127.0
      },
      {
        "name": "BenchmarkCompare_SingleSource_JSON/Compare/All/JSON/viper",
        "iterations": 76592,
        "ns_per_op": 15924.0,
        "bytes_per_op": 7327.0,
        "allocs_per_op": 127.0
      },
      {
        "name": "BenchmarkCompare_SingleSource_JSON/Compare/All/JSON/viper",
        "iterations": 74563,
        "ns_per_op": 15747.0,
        "bytes_per_op": 7327.0,
        "allocs_per_op": 127.0
      },
      {
        "name": "BenchmarkCompare_SingleSource_JSON/Compare/All/JSON/viper",
        "iterations": 75582,
        "ns_per_op": 15687.0,
        "bytes_per_op": 7327.0,
        "allocs_per_op": 127.0
      },
      {
        "name": "BenchmarkCompare_SingleSource_JSON/Compare/All/JSON/koanf",
        "iterations": 55508,
        "ns_per_op": 22030.0,
        "bytes_per_op": 9168.0,
        "allocs_per_op": 208.0
      },
      {
        "name": "BenchmarkCompare_SingleSource_JSON/Compare/All/JSON/koanf",
        "iterations": 54864,
        "ns_per_op": 21625.0,
        "bytes_per_op": 9168.0,
        "allocs_per_op": 208.0
      },
      {
        "name": "BenchmarkCompare_SingleSource_JSON/Compare/All/JSON/koanf",
        "iterations": 55206,
        "ns_per_op": 21364.0,
        "bytes_per_op": 9168.0,
        "allocs_per_op": 208.0
      },
      {
        "name": "BenchmarkCompare_SingleSource_JSON/Compare/All/JSON/koanf",
        "iterations": 55050,
        "ns_per_op": 21209.0,
        "bytes_per_op": 9168.0,
        "allocs_per_op": 208.0
      },
      {
        "name": "BenchmarkCompare_SingleSource_JSON/Compare/All/JSON/koanf",
        "iterations": 56079,
        "ns_per_op": 21366.0,
        "bytes_per_op": 9168.0,
        "allocs_per_op": 208.0
      },
      {
        "name": "BenchmarkCompare_SingleSource_JSON/Compare/All/JSON/koanf",
        "iterations": 54906,
        "ns_per_op": 21071.0,
        "bytes_per_op": 9168.0,
        "allocs_per_op": 208.0
      },
      {
        "name": "BenchmarkCompare_SingleSource_JSON/Compare/All/JSON/koanf",
        "iterations": 55494,
        "ns_per_op": 21119.0,
        "bytes_per_op": 9168.0,
        "allocs_per_op": 208.0
      },
      {
        "name": "BenchmarkCompare_SingleSource_JSON/Compare/All/JSON/koanf",
        "iterations": 56820,
        "ns_per_op": 21374.0,
        "bytes_per_op": 9168.0,
        "allocs_per_op": 208.0
      },
      {
        "name": "BenchmarkCompare_SingleSource_JSON/Compare/All/JSON/koanf",
        "iterations": 54508,
        "ns_per_op": 21747.0,
        "bytes_per_op": 9168.0,
        "allocs_per_op": 208.0
      },
      {
        "name": "BenchmarkCompare_SingleSource_JSON/Compare/All/JSON/koanf",
        "iterations": 56080,
        "ns_per_op": 21163.0,
        "bytes_per_op": 9168.0,
        "allocs_per_op": 208.0
      },
      {
        "name": "BenchmarkCompare_SingleSource_YAML/Compare/All/YAML/go-config",
        "iterations": 1457254,
        "ns_per_op": 807.8,
        "bytes_per_op": 104.0,
        "allocs_per_op": 4.0
      },
      {
        "name": "BenchmarkCompare_SingleSource_YAML/Compare/All/YAML/go-config",
        "iterations": 1474910,
        "ns_per_op": 825.7,
        "bytes_per_op": 104.0,
        "allocs_per_op": 4.0
      },
      {
        "name": "BenchmarkCompare_SingleSource_YAML/Compare/All/YAML/go-config",
        "iterations": 1479078,
        "ns_per_op": 814.8,
        "bytes_per_op": 104.0,
        "allocs_per_op": 4.0
      },
      {
        "name": "BenchmarkCompare_SingleSource_YAML/Compare/All/YAML/go-config",
        "iterations": 1448262,
        "ns_per_op": 825.3,
        "bytes_per_op": 104.0,
        "allocs_per_op": 4.0
      },
      {
        "name": "BenchmarkCompare_SingleSource_YAML/Compare/All/YAML/go-config",
        "iterations": 1442907,
        "ns_per_op": 882.9,
        "bytes_per_op": 104.0,
        "allocs_per_op": 4.0
      },
      {
        "name": "BenchmarkCompare_SingleSource_YAML/Compare/All/YAML/go-config",
        "iterations": 1476528,
        "ns_per_op": 818.0,
        "bytes_per_op": 104.0,
        "allocs_per_op": 4.0
      },
      {
        "name": "BenchmarkCompare_SingleSource_YAML/Compare/All/YAML/go-config",
        "iterations": 1463547,
        "ns_per_op": 804.9,
        "bytes_per_op": 104.0,
        "allocs_per_op": 4.0
      },
      {
        "name": "BenchmarkCompare_SingleSource_YAML/Compare/All/YAML/go-config",
        "iterations": 1486202,
        "ns_per_op": 821.2,
        "bytes_per_op": 104.0,
        "allocs_per_op": 4.0
      },
      {
        "name": "BenchmarkCompare_SingleSource_YAML/Compare/All/YAML/go-config",
        "iterations": 1414278,
        "ns_per_op": 825.2,
        "bytes_per_op": 104.0,
        "allocs_per_op": 4.0
      },
      {
        "name": "BenchmarkCompare_SingleSource_YAML/Compare/All/YAML/go-config",
        "iterations": 1449002,
        "ns_per_op": 811.9,
        "bytes_per_op": 104.0,
        "allocs_per_op": 4.0
      },
      {
        "name": "BenchmarkCompare_SingleSource_YAML/Compare/All/YAML/viper",
        "iterations": 39800,
        "ns_per_op": 29861.0,
        "bytes_per_op": 16024.0,
        "allocs_per_op": 203.0
      },
      {
        "name": "BenchmarkCompare_SingleSource_YAML/Compare/All/YAML/viper",
        "iterations": 40592,
        "ns_per_op": 29860.0,
        "bytes_per_op": 16024.0,
        "allocs_per_op": 203.0
      },
      {